id,name,lat,lon,x,y,d1641_id,wdl_id,agency,alias,quality,stage,flow,notes
B95020,San Joaquin at Antioch,38.01784713,-121.802883,605075.1,4208474.7,D12A,B95020,dwr_ncro,ANH,,x,,USBR and DWR have equipment within a 30x30 building (in a 10x10 room) located on a pier that is the City of Antioch's pumping station
B94175,Mokelumne River at Benson's Ferry,38.2555,-121.44,636491.3,4235314.6,,B94175,dwr_ncro,BEN,,x,,
CCS,Cache Slough,38.29713655,-121.7477601,609500.3,4239525.4,,,usbr,CCS,x,,,Old Vallejo Pumping Plant
B95290,Old River at Coney Island,37.8461,-121.5369,628727.8,4189748.3,,B95290,dwr_ncro,CIS,,x,,
CLC,Clifton Court,37.8298,-121.5574,626952,4187911.6,C9,,dwr_om,CLC,x,,,"Not 100% sure this is C9. If so, C9 was at one time outside Forebay on other side of the levee"
B95260,Discovery Bay at Indian Slough,37.91798191,-121.5868197,624214.6,4197656.5,,B95260,dwr_ncro,DBI,,x,,
B95325,Doughty Cut above Grant Line Canal,37.815,-121.425,638631.8,4186457.6,,B95325,dwr_ncro,DGL,x,x,,
B91120,Sacramento River at Emmaton,38.08428584,-121.7388746,610598.8,4215917.6,D22A,B91120,dwr_ncro,D22,x,,,DWR and USBR at same site at end of pier. Bureau listed as D22A
FRP,Farrar Park,38.01186758,-121.6390022,619475.5,4208005.7,,,usbr,FRP,x,,,Moved to this covered berth according to description by Dominique Azpeitia
B95300,Grant Line Canal at Tracy Rd Bridge,37.82010741,-121.4496329,636454.1,4186988.1,,B95300,dwr_ncro,GCT,x,x,,
GLN,Green's Landing,38.3456,-121.5468,626989.2,4245160.4,,,usbr,GLN,,,,Not confirmed. C3 (Hood) intended to replace this station
HBP,Harvey O Banks PP,37.79827347,-121.6236022,623690.4,4187532.5,,,dwr,HBP,x,,,Not sure about HRO vs HBP. Both siginficantly nudged to accommodate domain
HLL,Holland Tract,38.00701135,-121.580556,624614.6,4207543.5,,,usbr,HLL,x,,,
HRO,Harvey O Banks PP,37.79827347,-121.6236022,623690.4,4187532.5,,,dwr,HRO,,,x,Not sure about HRO vs HBP. Both siginficantly nudged to accommodate domain
IDB,CCWD Old River near Discovery Bay,37.88577903,-121.575998,625220.4,4194097.8,,,ccwd,IDB,,,x,
INB,CCWD Rock Slough PP,37.99627352,-121.7019022,613977.7,4206196.5,,,ccwd,INB,x,,,
B95283,Italian Slough Headwater near Byron,37.83829885,-121.6015684,623050.7,4188795.5,,B95283,dwr,ISH,,x,,
JER,Jersey Point,38.05216585,-121.6889874,615024.3,4212414.2,D15,,usbr,JER,x,,,Pier is used by USBR and possibly USGS for wq
MAL,Sacramento River at Mallard Island,38.04288249,-121.9201106,594757.5,4211123.3,D10A,<Null>,dwr_des,MAL,x,x,,Collocated with MWQI Mallardis
B95530,Middle River at Howard Rd Bridge,37.877,-121.3835,642165.8,4193399.5,,B95530,dwr,MHR,x,x,,
B95820,San Joaquin at Mossdale Bridge,37.78613049,-121.3064425,649126.1,4183436.8,C7A,B95820,dwr,MSD,,x,x,"Flow transect is 0.25 miles ds from bridge. Was once at bridge, but ferrous metals interfered with"
B95503,Middle River at Tracy Blvd,37.8816,-121.456,635780.8,4193802,,B95503,dwr,MTB,x,x,,
B95366,Old River Barrier near DMC (Above),37.81055556,-121.5422222,628312.5,4185763.1,,B95366,dwr,OAD,x,x,,"At OAD, NCRO collects stage, EC, pH, DO, turbidity and chlorophyll above the temp barrier (B95366 and B953660) and telemeters it.  "
B95365,Old River below Dam,37.8116,-121.547,627898.6,4185906.3,,B95365,dwr,OBD,x,x,,At OBD NCRO collects only stage (B95365) and telemeters. 
B95250,Old River at Bacon Island,37.96791667,-121.5743889,625406.5,4203423.6,,B95250,dwr,BAC,x,x,,Collocated with USGS 11313405 on USGS pile. Historically across river.
B95400,Old River at Head,37.808,-121.329,647096.2,4185827.7,,B95400,dwr,OH1,x,x,x,
B95270,Old River at Byron,37.8911,-121.57,625738.9,4194696.3,,B95270,dwr,ORB,,x,,
PPT,Prisoners Point,38.0563597,-121.5499831,627213.4,4213060.7,D29,,dwr_des,PPT,x,,,Identified by Mike Dempsey
B95218,Rock Slough at Contra Costa Canal,37.976,-121.635,619885.2,4204031,,B95218,dwr,RSL,x,x,,
SAL,San Andreas Landing,38.10327819,-121.5912553,623513.4,4218211.2,C4,,usbr,SAL,x,,,Confirmed by USBR
SJR,San Joaquin River Mccune Station near Vernalis,37.6791908,-121.2648837,653005.8,4171637.9,C10A,,dwr_des,SJR,x,x,x,"C10A is jointly operated by DWR and IEP-EMP. Collocated with VER. Flow monitoring discontinued and considered unsuccessful, so USGS is the best for that and it is upstream at the bridge."
STI,Mokelumne River (South Fork) @ Staten Island,38.11685852,-121.4989048,631586.4,4219845,C13,,usbr,STI,x,,,
B91160,Sacramento River at Threemile Slough,38.106,-121.7,613974.4,4218374.1,,B91160,dwr,TMS,x,,,
B95421,Tom Paine Sl above intake,37.7900829,-121.4184369,639266.,4183708.,,B95421,dwr_ncro,TPI,x,x,,wdl: B95421 for stage and B9542100 for temp and EC
B95425,Tom Paine Sl near Pescadero,37.76724044,-121.3514436,645200.2,4181269.9,,B95425,dwr_ncro,TPP,,x,,
B95420,Tom Paine Sl above the mouth,37.79054048,-121.4187437,639228.5,4183752.9,,B95420,dwr_ncro,TPS,,x,,
TRP,Tracy Pumping Plant,37.80027343,-121.584902,624581.2,4184598.4,,,dwr_om,TRP,x,,x,
UNI,Union Island,37.82209337,-121.3750095,643018.6,4187320.1,C8,,usbr,UNI,x,,,"Historically called """"bifurcation of Middle and Old Rivers"""""
VIC,Victoria Island,37.89122605,-121.48825,632927.2,4194823.6,,,usbr,VIC,x,,,Not confirmed
BKS,Barker Slough Pumping Plant,38.27639642,-121.7969582,605228,4237166.9,,,dwr,BKS,x,,x,Slightly moved closer to slough. D1461 site was in another side slough upstream.
JTR,Jones Tract,37.9202,-121.5165,630392,4197998.7,,,dwr_ncro,JTR,,x,x,"NCRO station, but apparently not on WDL"
B95580,Venice Island,38.0491,-121.4976,631822.4,4212328.2,,B95580,dwr,VNI,,x,,same as the WDL B95580
CSE,Sacramento River at Collinsville,38.07394957,-121.8500958,600859.1,4214643.6,C2B,,dwr_des,CSE,x,x,,
SRH,Sacramento River at Hood,38.36771516,-121.5205061,629247.7,4247651,C3A,,dwr_des,C3A,x,,,"Colocated wiht MWQI """"HOOD"""" Established to replace C3. Location confirmed visually by DES (there is a bogus location north)."
D11,Sherman Lake near Antioch,38.04228393,-121.7995119,605341,4211186.7,D11,,dwr,D11,,,,
D16,San Joaquin River at Twitchell Island,38.09689544,-121.6691177,616696.5,4217402.2,,B9D80581401,dwr,D16,,,,"wdl 1st sample date:2/8/1968, last sample date: 5/19/1998"
D19,Frank's Tract near Russo's landing,38.04376352,-121.6147731,621549.8,4211576.3,,,dwr,D19,,,,
B91212,Sacramento River at Rio Vista,38.15974033,-121.6862425,615096.2,4224354.2,D24A,B91212,dwr,RVB,,x,,DWR Rio Vista site
MRZ,Sacramento River at Martinez,38.02761665,-122.1405194,575432.5,4209227.7,C6A,,dwr_des,MRZ,x,x,,
D9,Honker Bay,38.0724452,-121.9392323,593042.2,4214384.2,D9,,dwr,D9,,,,
SNC,Chadbourne Slough at Sunrise Duck Club,38.18503208,-122.0830545,580303.5,4226742.3,S21,,dwr,SNC,,x,,Not confirmed
GYS,Goodyear Slough at Morrow Island club,38.11908576,-122.0957696,579250.3,4219415,S35,,dwr,GYS,x,x,,Not confirmed
VOL,Suisun Slough 300' south of Volanti Slough,38.180526,-122.0469582,583460,4226234.2,S42,,dwr,VOL,x,x,,Not confirmed
BDL,Montezuma Slough near Beldons Landing,38.186785,-121.9707745,590134.7,4227040.1,S49,,dwr_des,BDL,x,x,,Not confirmed. Moved to pier.
IBS,Cordelia Slough at Ibis club,38.15729922,-122.1136785,577650.9,4223639,S97,,dwr,IBS,x,x,,
B91560,Yolo Bypass at Lisbon,38.47503915,-121.5885124,623124,4259467.4,,B91560,dwr_ncro,LIS,x,x,x,
WCI,West Canal near Clifton Court Intake,37.83161222,-121.5540556,627243.2,4188117.2,,B95338,dwr_ncro,WCI,,,x,
B95341,Old River near Clifton Court Intake,37.82797167,-121.5526014,627377.4,4187715.2,,B95341,dwr,ORI,,,x,ADCP flow station
RCS,Ridge Cut Slough at Knight's Landing,38.79378266,-121.7253592,610695,4294664.3,,,dwr_ncro,RCS,x,x,x,
E33670,Montezuma Slough at National Steel,38.12202682,-121.8882107,597451.6,4219938,S64,E33670,dwr_ncro,NSL,x,x,x,
B95765,San Joaquin River near Lathrop,37.81097104,-121.3234822,647576.1,4186166.1,,B95765,dwr_ncro,SJL,x,x,x,Not confirmed. Moved to pier.
B95740,San Joaquin River at Brandt Bridge,37.86457483,-121.3231244,647500.8,4192114.6,,B95740,dwr_ncro,BDT,x,x,x,
B95660,Rough and Ready Island,37.96277611,-121.3655772,643575.2,4202944.9,,B95660,dwr_ncro,RRI,,x,x,a station house on the very corner of that final boat dock on Rough and Ready.
B95541,Middle River at Undine Road,37.83393039,-121.3857254,642052.7,4188617.1,,B95541,dwr_ncro,MRU,x,,x,
B95380,Old River at Tracy Blvd,37.80472564,-121.4495285,636491.6,4185281.5,P12,B95380,dwr_ncro,OLD,x,x,x,"wdl: B95380Q: ADCP station with flow and velocity data. B95380: stage, temp, and EC"
s08010,Southampton Shoal Channel LB 6,37.91625,-122.4223333,550775.4,4196680.1,,,noaa,s08010,,,,
s06010,Martinez-AMORCO Pier,38.03463333,-122.12525,576765.3,4210018.7,,,noaa,s06010,,,,
tibc1,Tiburon Pier,37.89117018,-122.4461449,548699,4193884.8,,,noaa,tibc1,x,,,
scqc1,China Camp,38.00117026,-122.4591436,547485.2,4206082.9,,,noaa,scqc1,x,,,
9414290,San Francisco,37.8067,-122.465,547094.8,4184503.1,,,noaa,9414290,,x,,
9414750,Alameda,37.77161379,-122.2993982,561701.6,4180706.7,,,noaa,9414750,,x,,
9414358,Hunters Point,37.73,-122.357,556660.3,4176053.2,,,noaa,9414358,,,,
9414688,San Leandro Marina,37.69527397,-122.1919044,571241.8,4172313.1,,,noaa,9414688,,,,Removed 2005
9414458,San Mateo Bridge,37.58,-122.253,565957.4,4159479,,,noaa,9414458,,,,
9414523,Redwood City,37.506974,-122.2099047,569646.3,4151469.7,,,noaa,9414523,,x,,Nudged
9414509,Dumbarton Bridge,37.5067,-122.115,578219,4151452.5,,,noaa,9414509,,x,,
9414575,Coyote Creek,37.465,-122.023,586398.5,4146906.5,,,noaa,9414575,,x,,
9414863,Richmond,37.92820794,-122.3999317,552736,4198019.3,,,noaa,9414863,,x,,
ANC,Antioch,38.01784713,-121.802883,605075.1,4208474.7,,,usbr,ANC,x,,,
CLL,Collinsville,38.07394957,-121.8500958,600858.7,4214644.1,,,usbr,CLL,x,,,
CNT,Contra Costa,37.99587604,-121.7017029,613995.8,4206152.6,C5,,usbr,CNT,x,,,
EMM,Emmaton,38.08428584,-121.7388746,610598.8,4215917.6,D22A,,usbr,EMM,x,,,"DWR and USBR listed at same site at end of pier, USBR is listed as D22A"
PTS,PIttsburg,38.04316356,-121.8918355,597238.3,4211183.7,,,usbr,PTS,x,,,
RIV,Rio Vista,38.15916838,-121.6844634,615252.9,4224292.9,D24A,,usbr,RIV,x,,,Under bridge tenders office almost in center of channel
VER,Vernalis,37.6791908,-121.2648837,653005.8,4171637.9,C10,,usbr,VER,x,,,Relocated from Durham Farry/Airoport Way Bridge to DWR pier where SJR is located
PCT,Port Chicago,38.05893797,-122.024823,585550.4,4212803.2,C14,,usbr,PCT,x,,,Pier 2 (1 mile upstream from NOAA site)
11162765,"SF Bay at San Mateo Bridge Near Foster City, CA",37.58437876,-122.2508005,566147.7,4159966.4,,,usgs,11162765,x,,,
11169025,"Guadalupe R above Hw 101 at San Jose, CA",37.37410337,-121.9329168,594479.1,4136908.3,,,usgs,11169025,,,,
11172175,Coyote Creek above HW 237,37.42243546,-121.9273615,594910,4142276.1,,,usgs,11172175,,,,
11303500,San Joaquin R near Vernalis,37.6760987,-121.2655001,652957.8,4171293.8,,,usgs,VNS,,x,x,
11304810,San Joaquin R below Garwood Bridge,37.93546702,-121.3302259,646735.2,4199969.7,,,usgs,SJG,x,x,x,The gage is at the bottom of some concrete stairs that go to a pump stand. The gage is at the bottom of some concrete stairs that go to a pump stand. Bottom of concrete stairs that go to a pump stand. This location is not very carefully identified yet.
11311300,Turner Cut near Holt,37.9925,-121.4538889,635762.3,4206110.6,,,usgs,TRN,,x,x,"USGS collects flow data on a pile they installed.  NCRO collects temp, pH, EC, DO, turbidity, chlorophyll on pile with USGS and uses USGS telemetry."
11312672,Victoria Canal near Byron,37.8708333,-121.53,629291.6,4192502.2,,,usgs,VCU,,x,x,Not confirmed. Boat access.
11312676,Middle R at Middle River,37.94266627,-121.5338075,628839.5,4200455,,,usgs,MDM,x,x,x,
11312685,Middle R near Holt,38.00305556,-121.5108985,630737.3,4207200.2,,,usgs,HLT,,x,x,"USGS collects flow data on a pile they installed.  NCRO collects temp, EC, turbidity and chlorophyll on pile with USGS and uses USGS telemetry.  All data on CDEC"
11312968,Old R near Delta Mendota Canal,37.81025086,-121.5423248,628312.5,4185763.1,,,usgs,ODM,,x,x," At ODM which is on a pile, USGS collects flow while NCRO collects  temp, pH, EC, DO, turbidity and chlorophyll using USGS telemetry equipment."
11313200,Grantline Canal,37.82010741,-121.4496329,627753,4186838.8,,,usgs,GLC,,x,x,"Replaces a station located on the Tracy Rd Bridge (5 miles east of the piling). Located on pile (B95320).  USGS measures flow whiles NCRO measures temp, EC pH, DO turbidity and chlorophyll.  USGS telemeters this data  "
11313315,Old R near Byron,37.89103627,-121.5702283,625718.9,4194688.9,,,usgs,OH4,x,x,x,On bridge
11313405,Old R at Bacon Island,37.96791667,-121.5743889,625222.5,4203213.9,,,usgs,OBI,x,x,x,
11313431,Holland Cut near Bethel Island,38.01638889,-121.5819444,624476.9,4208582.2,,,usgs,HOL,,x,x,"At HOL, USGS collects flow data while NCRO collects EC, temp and turbidity.  USGS telemeters the data."
11313433,Dutch Sl below Jersey Island,38.0130657,-121.670862,616676.6,4208098.2,,,usgs,DSJ,x,x,x,Not confirmed
11313434,Old R at Quimby Island,38.0272222,-121.5644444,625994.6,4209807.9,,,usgs,ORQ,,x,x,
11313440,False R near Oakley,38.0558333,-121.6669444,616952.5,4212848.6,,,usgs,FAL,,x,x,"Both FAL and ORQ are USGS station where they collect flow and NCRO collects EC, chlorophyll, temp and turbidity"
11313452,Old R at Franks Tract,38.0711111,-121.5788889,624652.3,4214658.4,,,usgs,OSJ,,x,x,"At OSJ USGS collects flow data while NCRO collects temp, EC, turbidity and chlorophyll.  USGS telemeters the data."
11313460,San Joaquin R at Prisoners Pt,38.05944444,-121.5572222,626573,4213393.1,,,usgs,PRI,x,x,x,"Boat access only on a pile, not carefully registered here. Flow and vertical datum considered suspect"
11336600,Delta Cross Channel near Walnut Grove,38.24477822,-121.5052384,630802.2,4234030.6,,,usgs,DLC ,x,x,x,
11336790,Little Potato Slough at Terminous,38.09638889,-121.496111,631868.1,4217577.6,,,usgs,LPS,x,x,x,
11336930,Mokelumne R at Andrus Island,38.1061111,-121.571111,625274.8,4218552.5,,,usgs,MOK,,x,x,"At MOK, USGS collects flow data while NCRO collects temp, EC and turbidity.  USGS telemeters the data."
11337080,Threemile Slough near Rio Vista,38.1033333,-121.686111,615196.3,4218095.3,,,usgs,TSL,x,x,x,
11337190,San Joaquin R at Jersey Point,38.05222551,-121.6889328,615029,4212420.9,,,usgs,SJJ,x,x,x,"Originally collocated with USBR station, now (according to USBR) on platform 100m up accessible by boat."
11447650,Sacramento R at Freeport,38.45601954,-121.5013437,630762.5,4257477,,,usgs,FPT,x,x,x,Pass Freeport bridge on rt. (wrong side of bridge?). Entrance to gage sites from walkway on right side of Freeport Bridge footing. 
11447830,Sutter Slough at Courtland,38.32841998,-121.5773549,624348.3,4243212.4,,,usgs,SUT,x,x,x,
11447850,Steamboat Slough btw Sacramento R and Sutter Sl,38.28477024,-121.5867841,623598.2,4238356.2,,,usgs,SSS,x,x,x,
11447890,Sacramento R above Delta Cross Channel,38.25752555,-121.5179832,629664.2,4235427.1,,,usgs,SDC,x,x,x,On pump stand
11447903,Georgiana Slough near Sacramento R,38.23726412,-121.5176741,629727.3,4233179.3,,,usgs,GSS,x,x,x,
11447905,Sacramento R below Georgiana Slough,38.23889218,-121.5234467,629219.1,4233351.8,,,usgs,GES,x,x,x,From USGS wiki
11455140,Toe Drain at Liberty Island near Courtland,38.34944012,-121.6449015,618409.8,4245456.2,,,usgs,11455140,x,x,x,Not confirmed. Not on USGS wiki site.
11455147,Liberty Cut at Liberty Island near Courtland,38.3225,-121.6672222,616502.5,4242438.4,,,usgs,11455147,x,x,x,
11455165,Miner Slough at HW 84 Bridge,38.29166667,-121.6308333,619734.2,4239063.4,,,usgs,HWB,x,x,x,
11455276,Shag Slough at Liberty Island near Courtland,38.3183333,-121.6930556,614250.8,4241943.7,,,usgs,11455276,x,x,x,
11455335,Sacramento R Deep Water Ship Channel Near Rio Vista,38.2561111,-121.6666667,616657.3,4235072.2,,,usgs,DWS,x,x,x,
11455350,Cache Slough at Ryer Island,38.21292541,-121.66896,616525.5,4230277.3,,,usgs,RYI,x,x,x,
11455420,Sacramento R at Rio Vista,38.14789999,-121.6898619,614797.6,4223035.8,,,usgs,SRV,x,x,x,"The flow station is under the bridge Red Channel Marker 28, transmitted from the DWR station 100' away. The WQ station is downstream a bit and is not confirmed."
11455780,Suisun Bay at Benicia Bridge,38.04492057,-122.1266323,576633.3,4211159,,,usgs,11455780,x,,,
11455820,Carquinez Strait at Carquinez Bridge near Crockett,38.0613095,-122.2255241,567940.8,4212900.6,,,usgs,11455820,x,,,
11458000,Napa R near Napa,38.36851973,-122.3032124,560869,4246934.1,,,usgs,NAP,,x,x,
11459150,Petaluma R at Copland Pumping Station,38.23852452,-122.6401691,531489.6,4232341.6,,,usgs,11459150,,,,
'373025122065901,San Francisco Bay at Old Dumbarton Bridge,37.50694444,-122.1163889,578096,4151478.4,,,usgs,3.73E+14,,x,,
'375607122264701,San Francisco Bay at Richmond-San Rafael Bridge,37.93527778,-122.4463889,548648.5,4198778.5,,,usgs,3.76E+14,x,,,
9415218,Mare Island,38.07,-122.25,565785.8,4213847.2,,,noaa,9415218,,x,,
9415143,Crockett,38.0583,-122.223,568165,4212568.5,,,noaa,9415143,,x,,
9415265,Suisun Slough Entrance,38.12065452,-122.0737802,581187.1,4219607.1,,,noaa,9415265,,x,,"Not confirmed. No detailed description, defunct 1989"
9415144,Port Chicago,38.056,-122.0395,584266.1,4212463.8,,,noaa,9415144,,x,,
9414811,Bradmoor Island,38.18285942,-121.9247926,594166.8,4226650.2,,,noaa,9414811,,x,,"Rogers Duck Club, pier behind shack. Discontinued 2006"
9415112,Mallard Island Ferry Wharf,38.0433,-121.918,594942.2,4211171.8,,,noaa,9415112,,x,,
9415064,Antioch,38.02,-121.815,604013.4,4208696.6,,,noaa,9415064,,x,,
9415316,Rio Vista,38.145,-121.692,614614.8,4222711.4,,,noaa,9415316,,x,,
B95620,San Joaquin River at Rindge Pump,37.99721718,-121.4194314,638779.3,4206684.9,,B95620,dwr_ncro,B95620,,x,,
A02100,Sacramento R at I Street,38.57164649,-121.5168395,630173.3,4272187.3,,A02100,dwr_ncro,IST,,x,,Not confirmed. This station is pegged to I Street bridge in photos based on description.
B94100,Georgiana Slough at Mokelumne R,38.13,-121.5802778,624430.5,4221190.9,,B94100,dwr_ncro,B94100,,x,,Not confirmed. Based on lat/long to 1 arc second from Central District
B91650,Sacramento R at Walnut Grove,38.24180921,-121.515902,629874.3,4233686.1,,B91650,dwr_ncro,SWE,x,x,,Not confirmed. Based on lat/long to 1 arc second from Central District and nudged to pier.
B91750,Sacramento R at Snodgrass,38.34999607,-121.533782,628119.1,4245666.2,,B91750,dwr_ncro,B91750,,x,,Not confirmed. Based on lat/long to 1 arc second from Central District and nudged to shore.
B95060,Threemile Slough at San Joaquin R,38.09002802,-121.6865309,615180.4,4216618.4,,B95060,dwr_ncro,SR3,x,x,,Not confirmed. Based on lat/long to 1 arc second from Central District and nudged to shore.
B95310,Grantline Canal above Dam,37.81958494,-121.4479993,636598.9,4186932.5,,B95310,dwr_ncro,B95310,,x,,Not confirmed. Based on lat/long to 1 arc second from Central District
B95340,Old R at Clifton Court Ferry,37.82862964,-121.5528418,627355.1,4187787.9,,B95340,dwr_ncro,B95340,,x,,"Not confirmed. Based on lat/long to 1 arc second from Central District; not ORI, about 80 meter north of ORI"
B95460,Middle R at Bacon Island,38.00180666,-121.523702,629615.4,4207043.7,,B95460,dwr_ncro,B95460,,x,,Not confirmed. Based on lat/long to 1 arc second from Central District and moved to pier
B95468,Middle R at Middle R,37.94000114,-121.5330499,628839.5,4200455,,B95468,dwr_ncro,B95468,x,x,,"USGS moved their flow station onto a pile and collects stage, EC, temp and turbidity which is telemetered.  NCRO collects stage, temp and EC on the levee next to the pile but is not telemetered."
B95500,Middle R at Borden Hw,37.89083333,-121.4883333,632905.7,4194776.6,,B95500,dwr_ncro,B95500,x,x,,Not confirmed. Based on lat/long to 1 arc second from Central District. Colocated with VIC?
B95540,Middle R at Mowry,37.83514791,-121.383011,642289.3,4188756.4,,B95540,dwr_ncro,B95540,,x,,Not confirmed. Based on lat/long to 1 arc second from Central District and nudged to pier
B9561600,Turner Cut near Holt,37.9925,-121.4538889,635762.3,4206110.6,,B9561600,dwr_ncro,TRN,x,,,"USGS collects flow data on a pile they installed.  NCRO collects temp, pH, EC, DO, turbidity, chlorophyll on pile with USGS and uses USGS telemetry."
B9528500,Victoria Canal near Byron,37.8708333,-121.53,629291.6,4192502.2,,B9528500,dwr_ncro,VCU,x,,,Not confirmed. Boat access.
B9545800,Middle R near Holt,38.00305556,-121.5108985,630737.3,4207200.2,,B9545800,dwr_ncro,HLT,x,,,"USGS collects flow data on a pile they installed.  NCRO collects temp, EC, turbidity and chlorophyll on pile with USGS and uses USGS telemetry.  All data on CDEC"
B9536600,Old River Barrier near DMC (Above) - WQ,37.81025,-121.542194,628312.5,4185763.1,,B9536600 ,dwr_ncro,OAD,x,,,"Is this ODM? At ODM which is on a pile, USGS collects flow while NCRO collects  temp, pH, EC, DO, turbidity and chlorophyll using USGS telemetry equipment."
B9529500,Grant Line Canal near Clifton Court Forebay - WQ ,37.82013889,-121.5446111,627753,4186838.8,,B9529500,dwr_ncro,GLC,x,,,"USGS measures flow whiles NCRO measures temp, EC pH, DO turbidity and chlorophyll.  USGS telemeters this data  (Station located on USGS pile 5.5 miles west of Tracy Rd. Bridge)"
B9512000,Holland Cut near Bethel Island,38.01638889,-121.5819444,624476.9,4208582.2,,B9512000,dwr_ncro,HOL,x,,,"At HOL, USGS collects flow data while NCRO collects EC, temp and turbidity.  USGS telemeters the data."
B9520000,Old R at Quimby Island,38.0272222,-121.5644444,625994.6,4209807.9,,B9520000,dwr_ncro,ORQ,x,,,
B9504400,False R near Oakley,38.0558333,-121.6669444,616952.5,4212848.6,,B9504400,dwr_ncro,FAL,x,,,"Both FAL and ORQ are USGS station where they collect flow and NCRO collects EC, chlorophyll, temp and turbidity"
B9510800,Old R at Franks Tract,38.0711111,-121.5788889,624652.3,4214658.4,,B9510800,dwr_ncro,OSJ,x,,,"At OSJ USGS collects flow data while NCRO collects temp, EC, turbidity and chlorophyll.  USGS telemeters the data."
B9409500,Mokelumne River near Highway 12 ,38.1061111,-121.571111,625274.8,4218552.5,,B9409500,dwr_ncro,MOK,x,,,"At MOK, USGS collects flow data while NCRO collects temp, EC and turbidity.  USGS telemeters the data."
B91479,Steamboat Slough Below Sutter Slough,38.25,-121.6020833,622318.4,4234477.5,,B91479,dwr_ncro,SUS,x,,,"SUS (cdec, 6/10/2015 ->) and B91479 (wdl, 10/1/1990 or 1982) same station or not? same station name, same parameters (temp, ec), but different time period and locations SUS (cdec, 6/10/2015 ->) and B91479 (wdl, 10/1/1990 or 1982) same station or not? same station name, same parameters (temp, ec), but different time period and locations"
B95378,Old River at Tracy Wildlife Association,37.802833,-121.457444,635798.2,4185059.9,,B95378,dwr_ncro,TWA,x,,,
B9521600,Rock Slough at Delta Road Bridge                                  ,37.97675,-121.6200833,621194.1,4204133.5,,B9521600,dwr_ncro,B9521600,x,,,
B9524900,Holland Cut at Holland Marina,37.97369444,-121.5812778,624631.5,4203880,,B9524900,dwr_ncro,B9524900,x,,,
B9522500,Werner Dredger Cut near Palm Tract,37.96397222,-121.5948333,623426.6,4202761.2,,B9522500,dwr_ncro,B9522500,x,,,
B95058,Piper Slough at Bethal Tract,38.03388889,-122.6216667,620982,4210523.4,,B95058,dwr_ncro,B95058,x,,,"Nudged. Verbal description is """"Russo's Marina at end of Piper Rd"""" but Russo's is a short distance north."
B9502900,San Joaquin River at Blind Point ,38.0325,-121.719083,612410.9,4210203.7,,B9502900,dwr_ncro,BLP,x,,,Nudged
RRI,Rough and Ready Island,37.96277611,-121.3655772,643575.2,4202944.9,,B95660,dwr_des,RRI,x,x,x,"a station house on the very corner of that final boat dock on Rough and Ready. same as B95660, should be deleted."
RVB,Sacramento River at Rio Vista,38.15974033,-121.6862425,615096.2,4224354.2,D24A,,dwr_des,RVB,x,x,,DWR Rio Vista site
ANH,San Joaquin at Antioch,38.01784713,-121.802883,605075.1,4208474.7,D12A,,dwr_des,ANH,x,x,,
MSD,San Joaquin at Mossdale Bridge,37.78613049,-121.3064425,649126.1,4183436.8,C7A,B95820,dwr_des,MSD,x,x,x,"Flow transect is 0.25 miles ds from bridge. Was once at bridge, but ferrous metals interfered with"
FRE,Sacramento River at Fremont Weir (West End),38.75944444,-121.6663889,615789.9,4290918.9,,A02170,dwr,FRE,,x,,Only source is CDEC
A02200,Sacramento River at Knights Landing,38.803348,-121.716391,611458.2,4295714.6,,A02200,dwr,POR,,x,,
DMC,DMC Headworks,37.78,-121.588,626882.7,4186454,,,usbr,DMC,x,,,Nudged to accommodate model domain
B95422,Sugar Cut,37.78836111,-121.4193889,639164.7,4183509.3,,B95422,dwr_ncro,SUR,x,,,
B95320,Grant Line Canal East,37.820258,-121.4348562,637754.4,4187026.5,,B95320,dwr_ncro,GLE,x,,x,"ADCP Flow Station, commence on 1/15/2013; WQ, commence on 2/15/2013"
B95502,Middle River above Barrier ,37.8851804,-121.4727615,634300.2,4194175,,B95502,dwr_ncro,MAB,,,x,"ADCP Flow Station, commence on 4/23/2013"
B95390,Old River above Doughty Cut,37.8109973,-121.3865757,642021.8,4186071.2,,B95390,dwr_ncro,ORX,x,,x,"ADCP Flow Station, commence on 1/30/2013"
B95760,San Joaquin River above Dos Reis,37.8223312,-121.3177244,648060.2,4187435.7,,B95760,dwr_nrco,SJD,,,x,"ADCP Flow Station, commence on 2/28/2013"
'374938122251801,San Francisco Bay at Northeast Shore Alcatraz Island,37.82722222,122.4216667,550895.2,4186802.8,,,usgs,'374938122251801,x,,,"location: unsurveyed, at end of finger pier adjacent to ferry terminal; WQ monitor since November 2013;Interruptions in record were due to malfunction of the sensing and (or) recording instrument and biological interference within the conductivity cell. The probe is set at 6 ft below the water surface at Mean Lower Low Water (MLLW). MLLW is about 16 ft. Daily maximums and minimums sometimes differ from tidal cycle (24.8 hours) maximums and minimums.Specific conductivity records are rated excellent except for the following periods of fouling: Oct. 1, 2, Nov. 2-8, Aug. 19, 20, which are rated good. Water temperature records are rated excellent."
B9550000,Middle R at Union Point - WQ,37.890778,-121.488361,632918.3,4194773.7,,B9550000,dwr_ncro,B9550000,x,,,Not confirmed. Based on lat/long to 1 arc second from Central District. Colocated with VIC?
